start_time	end_time	translated_text
0.20	13.70	그는 다양한 성격을 가지고 있고, 때로는 정말 농담 반쯤 하는 사람이나, 정말 능숙하게 엔지니어링 모드로 연기하는 사람을 만나기도 합니다. 하지만 때로는 클레어 부셰가 보여주는 것과 같은 모습을 보이기도 합니다.
14.50	26.90	그라임스라는 이름의 여자친구가끔 악마 모드를 부르는데, 그때 그는 어두워지고, 텍사스 남부 끝자락에 있는 보카, 치카라는 곳에 스타쉽을 위한 발사대가 있는데, 어느 금요일 밤 10시쯤에
26.90	28.60	그는 모든 것에 대해 농담을 하곤 했습니다.
28.90	32.50	그는 그곳에서 일하는 사람이 두 명뿐인 것을 본다.
32.50	33.10	오후 10시예요.
33.10	37.30	금요일 밤인데, 개가 보이면 그냥 폭발해 버리는 거예요.
37.30	47.20	약 1시간 동안 그는 사람들을 질책한 다음, 다음 날까지 200명을 모아서 일을 멈추라고 명령합니다.
47.20	51.20	드라마에 대한 이런 취향 역시 어린 시절에서 비롯됩니다.